{
  "category": "experimental",
  "status": "alpha",
  "purpose": "",
  "principle": "",
  "reusability": "",
  "limitations": "",
  "demo_links": [],
  "platforms": [],
  "stack": [],
  "name": "agency",
  "slug": "neurocult-agency",
  "description": "üïµÔ∏è‚Äç‚ôÇÔ∏è Library designed for developers eager to explore the potential of Large Language Models (LLMs) and other generative AI through a clean, effective, and Go-idiomatic approach.",
  "repository": "https://github.com/neurocult/agency",
  "stars": 480,
  "originator": "neurocult",
  "tags": [
    "agents",
    "ai",
    "artificial-general-intelligence",
    "artificial-intelligence",
    "artificial-neural-networks",
    "autonomous-agents",
    "chatgpt",
    "generative-ai",
    "go",
    "golang",
    "gpt",
    "language-models",
    "llm",
    "llmops",
    "machine-learning",
    "neural-network",
    "nlp",
    "openai",
    "rag",
    "vector-database"
  ],
  "open_source": true,
  "license": "MIT",
  "last_updated": "2025-01-08",
  "language": "Go"
}