{
  "category": "experimental",
  "status": "alpha",
  "purpose": "",
  "principle": "",
  "reusability": "",
  "limitations": "",
  "demo_links": [],
  "platforms": [],
  "stack": [],
  "name": "vectordb-recipes",
  "slug": "lancedb-vectordb-recipes",
  "description": "High quality resources & applications for LLMs, multi-modal models and VectorDBs ",
  "repository": "https://github.com/lancedb/vectordb-recipes",
  "stars": 772,
  "originator": "lancedb",
  "tags": [
    "agents",
    "ai",
    "deep-learning",
    "embeddings",
    "fine-tuning",
    "gpt",
    "gpt-4-vision",
    "langchain",
    "llama-index",
    "llms",
    "machine-learning",
    "multimodal",
    "openai",
    "rag",
    "vector-database"
  ],
  "open_source": true,
  "license": "Apache-2.0",
  "last_updated": "2025-05-15",
  "language": "Jupyter Notebook"
}