{
  "category": "experimental",
  "status": "alpha",
  "purpose": "",
  "principle": "",
  "reusability": "",
  "limitations": "",
  "demo_links": [],
  "platforms": [],
  "stack": [],
  "name": "BaseAI",
  "slug": "langbaseinc-baseai",
  "description": "BaseAI â€” The Web AI Framework. The easiest way to build serverless autonomous AI agents with memory. Start building local-first, agentic pipes, tools, and memory. Deploy serverless with one command.",
  "repository": "https://github.com/LangbaseInc/BaseAI",
  "stars": 1053,
  "originator": "LangbaseInc",
  "tags": [
    "ai",
    "anthropic",
    "artificial-intelligence",
    "baseai",
    "cohere",
    "firewor",
    "gemini",
    "grok",
    "groq",
    "langbase",
    "mistral",
    "openai",
    "perplexity",
    "togetherai",
    "xai"
  ],
  "open_source": true,
  "license": "NOASSERTION",
  "last_updated": "2025-02-25",
  "language": "TypeScript"
}