{
  "category": "experimental",
  "status": "alpha",
  "purpose": "",
  "principle": "",
  "reusability": "",
  "limitations": "",
  "demo_links": [],
  "platforms": [],
  "stack": [
    "TypeScript",
    "Python",
    "Jupyter Notebook",
    "Go",
    "Rust",
    "HTML",
    "JavaScript",
    "MDX",
    "Kotlin",
    "Ruby",
    "C",
    "Shell",
    "Handlebars",
    "Java",
    "C#",
    "C++",
    "Julia",
    "PHP",
    "Bicep",
    "Scala",
    "Dart",
    "Svelte",
    "PowerShell",
    "GDScript",
    "Elixir",
    "Ballerina",
    "Vue",
    "SCSS",
    "Move"
  ],
  "name": "armor-crypto-mcp",
  "slug": "armorwallet-armor-crypto-mcp",
  "description": "The MCP server for interacting with Blockchain, Swaps, Strategic Planning and more.",
  "repository": "https://github.com/armorwallet/armor-crypto-mcp",
  "stars": 136,
  "originator": "armorwallet",
  "tags": [
    "ai",
    "ai-agents",
    "cryptocurrency",
    "mcp",
    "tradingbot",
    "wallet"
  ],
  "open_source": true,
  "license": "GPL-3.0",
  "last_updated": "2025-05-27",
  "language": "Python"
}