{
  "category": "experimental",
  "status": "alpha",
  "purpose": "",
  "principle": "",
  "reusability": "",
  "limitations": "",
  "demo_links": [],
  "platforms": [],
  "stack": [
    "TypeScript",
    "Python",
    "Jupyter Notebook",
    "Go",
    "Rust",
    "HTML",
    "JavaScript",
    "MDX",
    "Kotlin",
    "Ruby",
    "C",
    "Shell",
    "Handlebars",
    "Java",
    "C#",
    "C++",
    "Julia",
    "PHP",
    "Bicep",
    "Scala",
    "Dart",
    "Svelte",
    "PowerShell",
    "GDScript",
    "Elixir",
    "Ballerina",
    "Vue",
    "SCSS",
    "Move",
    "Typst",
    "Clojure",
    "Lua",
    "YARA",
    "Fluent",
    "Zig"
  ],
  "name": "DrivAerNet",
  "slug": "mohamedelrefaie-drivaernet",
  "description": "A Large-Scale Multimodal Car Dataset with Computational Fluid Dynamics Simulations and Deep Learning Benchmarks",
  "repository": "https://github.com/Mohamedelrefaie/DrivAerNet",
  "stars": 310,
  "originator": "Mohamedelrefaie",
  "tags": [
    "3d-geometry",
    "aerodynamics",
    "car-design",
    "cfd",
    "computational-fluid-dynamics",
    "data-driven",
    "deep-learning",
    "deep-neural-networks",
    "dgcnn",
    "drivaer",
    "fluid-dynamics",
    "fluid-simulation",
    "generative-ai",
    "graph-neural-networks",
    "large-scale-dataset",
    "meshes",
    "openfoam",
    "parametric-design",
    "surrogate-modelling",
    "surrogate-models"
  ],
  "open_source": true,
  "license": "NOASSERTION",
  "last_updated": "2025-05-26",
  "language": "Python"
}