{
  "category": "experimental",
  "status": "alpha",
  "purpose": "",
  "principle": "",
  "reusability": "",
  "limitations": "",
  "demo_links": [],
  "platforms": [],
  "stack": [
    "TypeScript",
    "Python",
    "Jupyter Notebook",
    "Go",
    "Rust",
    "HTML",
    "JavaScript",
    "MDX",
    "Kotlin",
    "Ruby",
    "C",
    "Shell",
    "Handlebars",
    "Java",
    "C#",
    "C++",
    "Julia",
    "PHP",
    "Bicep",
    "Scala",
    "Dart",
    "Svelte",
    "PowerShell"
  ],
  "name": "ryoma",
  "slug": "project-ryoma-ryoma",
  "description": "Common AI agent framework solving your data problems",
  "repository": "https://github.com/project-ryoma/ryoma",
  "stars": 371,
  "originator": "project-ryoma",
  "tags": [
    "ai",
    "data-science",
    "llm"
  ],
  "open_source": true,
  "license": "Apache-2.0",
  "last_updated": "2025-05-19",
  "language": "Python"
}