{
  "category": "experimental",
  "status": "alpha",
  "purpose": "",
  "principle": "",
  "reusability": "",
  "limitations": "",
  "demo_links": [],
  "platforms": [],
  "stack": [
    "TypeScript",
    "Python",
    "Jupyter Notebook",
    "Go",
    "Rust",
    "HTML",
    "JavaScript",
    "MDX",
    "Kotlin",
    "Ruby",
    "C",
    "Shell",
    "Handlebars",
    "Java",
    "C#",
    "C++",
    "Julia",
    "PHP",
    "Bicep",
    "Scala",
    "Dart",
    "Svelte",
    "PowerShell",
    "GDScript",
    "Elixir",
    "Ballerina",
    "Vue",
    "SCSS",
    "Move",
    "Typst",
    "Clojure",
    "Lua",
    "YARA",
    "Fluent",
    "Zig"
  ],
  "name": "ai2thor",
  "slug": "allenai-ai2thor",
  "description": "An open-source platform for Visual AI.",
  "repository": "https://github.com/allenai/ai2thor",
  "stars": 1388,
  "originator": "allenai",
  "tags": [
    "artificial-intelligence",
    "computer-vision",
    "interaction",
    "physics-engine",
    "visual-ai"
  ],
  "open_source": true,
  "license": "Apache-2.0",
  "last_updated": "2025-05-28",
  "language": "C#"
}