{
  "category": "experimental",
  "status": "alpha",
  "purpose": "",
  "principle": "",
  "reusability": "",
  "limitations": "",
  "demo_links": [],
  "platforms": [],
  "stack": [
    "TypeScript",
    "Python",
    "Jupyter Notebook",
    "Go",
    "Rust",
    "HTML",
    "JavaScript",
    "MDX",
    "Kotlin",
    "Ruby",
    "C",
    "Shell",
    "Handlebars",
    "Java",
    "C#",
    "C++",
    "Julia",
    "PHP",
    "Bicep",
    "Scala",
    "Dart",
    "Svelte",
    "PowerShell",
    "GDScript",
    "Elixir",
    "Ballerina",
    "Vue",
    "SCSS",
    "Move",
    "Typst",
    "Clojure",
    "Lua",
    "YARA",
    "Fluent",
    "Zig"
  ],
  "name": "WebCanvas",
  "slug": "imeanai-webcanvas",
  "description": "All-in-one Web Agent framework for post-training. Start building with a few clicks!",
  "repository": "https://github.com/iMeanAI/WebCanvas",
  "stars": 252,
  "originator": "iMeanAI",
  "tags": [
    "agent",
    "benchmark-framework",
    "llm-agent",
    "llm-evaluation"
  ],
  "open_source": true,
  "license": "MIT",
  "last_updated": "2025-05-21",
  "language": "Python"
}