{
  "category": "experimental",
  "status": "alpha",
  "purpose": "",
  "principle": "",
  "reusability": "",
  "limitations": "",
  "demo_links": [],
  "platforms": [],
  "stack": [
    "TypeScript",
    "Python",
    "Jupyter Notebook",
    "Go",
    "Rust",
    "HTML",
    "JavaScript",
    "MDX",
    "Kotlin",
    "Ruby",
    "C",
    "Shell",
    "Handlebars",
    "Java",
    "C#",
    "C++",
    "Julia",
    "PHP",
    "Bicep",
    "Scala",
    "Dart",
    "Svelte",
    "PowerShell",
    "GDScript",
    "Elixir",
    "Ballerina",
    "Vue",
    "SCSS",
    "Move",
    "Typst",
    "Clojure",
    "Lua",
    "YARA",
    "Fluent",
    "Zig"
  ],
  "name": "botpress",
  "slug": "botpress-botpress",
  "description": "The open-source hub to build & deploy GPT/LLM Agents ⚡️",
  "repository": "https://github.com/botpress/botpress",
  "stars": 13751,
  "originator": "botpress",
  "tags": [
    "agent",
    "ai",
    "botpress",
    "chatbot",
    "chatgpt",
    "gpt",
    "gpt-4",
    "langchain",
    "llm",
    "nlp",
    "openai",
    "prompt"
  ],
  "open_source": true,
  "license": "MIT",
  "last_updated": "2025-05-28",
  "language": "TypeScript"
}