{
  "category": "experimental",
  "status": "alpha",
  "purpose": "",
  "principle": "",
  "reusability": "",
  "limitations": "",
  "demo_links": [],
  "platforms": [],
  "stack": [
    "TypeScript",
    "Python",
    "Jupyter Notebook",
    "Go",
    "Rust",
    "HTML",
    "JavaScript",
    "MDX",
    "Kotlin",
    "Ruby",
    "C",
    "Shell",
    "Handlebars",
    "Java",
    "C#",
    "C++",
    "Julia",
    "PHP",
    "Bicep",
    "Scala",
    "Dart",
    "Svelte",
    "PowerShell",
    "GDScript",
    "Elixir",
    "Ballerina",
    "Vue",
    "SCSS",
    "Move"
  ],
  "name": "swarmzero",
  "slug": "swarmzero-swarmzero",
  "description": "SwarmZero's SDK for building AI agents, swarms of agents and much more.",
  "repository": "https://github.com/swarmzero/swarmzero",
  "stars": 240,
  "originator": "swarmzero",
  "tags": [
    "agent-swarms",
    "ai",
    "ai-agent",
    "ai-agent-framework",
    "ai-agents",
    "ai-swarm",
    "ai-swarms",
    "artificial-intelligence",
    "decentralized-ai",
    "gen-ai",
    "gennerative-ai",
    "large-language-models",
    "llm",
    "multi-agent-framework",
    "multi-agent-systems",
    "swarm",
    "swarms"
  ],
  "open_source": true,
  "license": "Apache-2.0",
  "last_updated": "2025-05-25",
  "language": "Python"
}