{
  "category": "experimental",
  "status": "alpha",
  "purpose": "",
  "principle": "",
  "reusability": "",
  "limitations": "",
  "demo_links": [],
  "platforms": [],
  "stack": [
    "TypeScript",
    "Python",
    "Jupyter Notebook",
    "Go",
    "Rust",
    "HTML",
    "JavaScript",
    "MDX",
    "Kotlin",
    "Ruby",
    "C",
    "Shell",
    "Handlebars",
    "Java",
    "C#",
    "C++",
    "Julia",
    "PHP",
    "Bicep",
    "Scala",
    "Dart",
    "Svelte",
    "PowerShell",
    "GDScript",
    "Elixir",
    "Ballerina",
    "Vue",
    "SCSS",
    "Move",
    "Typst",
    "Clojure",
    "Lua"
  ],
  "name": "awesome-ui-agents",
  "slug": "opendilab-awesome-ui-agents",
  "description": "A curated list of of awesome UI agents resources, encompassing Web, App, OS, and beyond (continually updated)",
  "repository": "https://github.com/opendilab/awesome-ui-agents",
  "stars": 202,
  "originator": "opendilab",
  "tags": [],
  "open_source": true,
  "license": "Apache-2.0",
  "last_updated": "2025-03-12",
  "language": ""
}