{
  "category": "experimental",
  "status": "alpha",
  "purpose": "",
  "principle": "",
  "reusability": "",
  "limitations": "",
  "demo_links": [],
  "platforms": [],
  "stack": [
    "TypeScript",
    "Python",
    "Jupyter Notebook",
    "Go"
  ],
  "name": "ai-agent-cognitivedriftt",
  "slug": "dabit3-ai-agent-cognitivedriftt",
  "description": "Cognitive Drift AI Agent",
  "repository": "https://github.com/dabit3/ai-agent-cognitivedriftt",
  "stars": 116,
  "originator": "dabit3",
  "tags": [],
  "open_source": true,
  "license": "MIT",
  "last_updated": "2024-12-10",
  "language": "TypeScript"
}