{
  "category": "experimental",
  "status": "alpha",
  "purpose": "",
  "principle": "",
  "reusability": "",
  "limitations": "",
  "demo_links": [],
  "platforms": [],
  "stack": [
    "TypeScript",
    "Python",
    "Jupyter Notebook",
    "Go",
    "Rust",
    "HTML",
    "JavaScript",
    "MDX",
    "Kotlin",
    "Ruby",
    "C",
    "Shell",
    "Handlebars",
    "Java",
    "C#",
    "C++",
    "Julia",
    "PHP",
    "Bicep",
    "Scala",
    "Dart",
    "Svelte",
    "PowerShell",
    "GDScript",
    "Elixir",
    "Ballerina",
    "Vue",
    "SCSS",
    "Move"
  ],
  "name": "wingman-ai",
  "slug": "russellcanfield-wingman-ai",
  "description": "An open-source VSCode extension, the AI coding assistant, integrates with Ollama, HuggingFace, OpenAI, and Anthropic.",
  "repository": "https://github.com/RussellCanfield/wingman-ai",
  "stars": 231,
  "originator": "RussellCanfield",
  "tags": [],
  "open_source": true,
  "license": "MIT",
  "last_updated": "2025-05-19",
  "language": "TypeScript"
}