{
  "category": "experimental",
  "status": "alpha",
  "purpose": "",
  "principle": "",
  "reusability": "",
  "limitations": "",
  "demo_links": [],
  "platforms": [],
  "stack": [
    "TypeScript",
    "Python",
    "Jupyter Notebook",
    "Go",
    "Rust",
    "HTML",
    "JavaScript",
    "MDX",
    "Kotlin",
    "Ruby",
    "C",
    "Shell",
    "Handlebars",
    "Java",
    "C#",
    "C++",
    "Julia",
    "PHP",
    "Bicep",
    "Scala"
  ],
  "name": "aitour-azure-openai-assistants",
  "slug": "microsoft-aitour-azure-openai-assistants",
  "description": "N/A",
  "repository": "https://github.com/microsoft/aitour-azure-openai-assistants",
  "stars": 128,
  "originator": "microsoft",
  "tags": [],
  "open_source": true,
  "license": "MIT",
  "last_updated": "2025-05-12",
  "language": "Python"
}