{
  "category": "experimental",
  "status": "alpha",
  "purpose": "",
  "principle": "",
  "reusability": "",
  "limitations": "",
  "demo_links": [],
  "platforms": [],
  "stack": [
    "TypeScript",
    "Python",
    "Jupyter Notebook",
    "Go",
    "Rust",
    "HTML",
    "JavaScript",
    "MDX",
    "Kotlin",
    "Ruby",
    "C",
    "Shell",
    "Handlebars",
    "Java",
    "C#",
    "C++",
    "Julia",
    "PHP"
  ],
  "name": "AugmentOS",
  "slug": "augmentos-community-augmentos",
  "description": "Smart glasses OS, with dozens of built-in apps. Users get AI assistant, notifications, translation, screen mirror, captions, and more. Devs get to write 1 app that runs on any pair of smart glases.",
  "repository": "https://github.com/AugmentOS-Community/AugmentOS",
  "stars": 514,
  "originator": "AugmentOS-Community",
  "tags": [
    "activelook",
    "conversational-ai",
    "rayneo",
    "smart-glasses",
    "smartglasses",
    "vuzix",
    "vuzix-shield",
    "vuzix-ultralite",
    "wearable",
    "wearables"
  ],
  "open_source": true,
  "license": "MIT",
  "last_updated": "2025-05-29",
  "language": "Java"
}