{
  "category": "experimental",
  "status": "alpha",
  "purpose": "",
  "principle": "",
  "reusability": "",
  "limitations": "",
  "demo_links": [],
  "platforms": [],
  "stack": [
    "TypeScript",
    "Python",
    "Jupyter Notebook",
    "Go",
    "Rust",
    "HTML",
    "JavaScript",
    "MDX",
    "Kotlin",
    "Ruby",
    "C",
    "Shell",
    "Handlebars",
    "Java",
    "C#",
    "C++",
    "Julia",
    "PHP",
    "Bicep",
    "Scala",
    "Dart",
    "Svelte",
    "PowerShell",
    "GDScript",
    "Elixir",
    "Ballerina",
    "Vue",
    "SCSS",
    "Move"
  ],
  "name": "shire",
  "slug": "phodal-shire",
  "description": "Empower Your Dev Ecosystem with AI Agents, Automate with Your AI Copilot, Elevate Your Code.",
  "repository": "https://github.com/phodal/shire",
  "stars": 252,
  "originator": "phodal",
  "tags": [
    "ai",
    "ai-agents",
    "intellij-plugin",
    "llm"
  ],
  "open_source": true,
  "license": "MPL-2.0",
  "last_updated": "2025-05-14",
  "language": "Kotlin"
}