{
  "category": "experimental",
  "status": "alpha",
  "purpose": "",
  "principle": "",
  "reusability": "",
  "limitations": "",
  "demo_links": [],
  "platforms": [],
  "stack": [
    "TypeScript",
    "Python",
    "Jupyter Notebook",
    "Go",
    "Rust",
    "HTML",
    "JavaScript",
    "MDX",
    "Kotlin",
    "Ruby",
    "C",
    "Shell",
    "Handlebars",
    "Java",
    "C#",
    "C++",
    "Julia",
    "PHP",
    "Bicep",
    "Scala"
  ],
  "name": "line-bot-mcp-server",
  "slug": "line-line-bot-mcp-server",
  "description": "MCP server that integrates the LINE Messaging API to connect an AI Agent to the LINE Official Account.",
  "repository": "https://github.com/line/line-bot-mcp-server",
  "stars": 386,
  "originator": "line",
  "tags": [
    "line",
    "linebot",
    "mcp",
    "mcp-server"
  ],
  "open_source": true,
  "license": "Apache-2.0",
  "last_updated": "2025-05-29",
  "language": "JavaScript"
}