{
  "category": "experimental",
  "status": "alpha",
  "purpose": "",
  "principle": "",
  "reusability": "",
  "limitations": "",
  "demo_links": [],
  "platforms": [],
  "stack": [],
  "name": "pipeshub-ai",
  "slug": "pipeshub-ai-pipeshub-ai-1",
  "description": "The OpenSource Alternative to Glean's Workplace AI",
  "repository": "https://github.com/pipeshub-ai/pipeshub-ai",
  "stars": 461,
  "originator": "pipeshub-ai",
  "tags": [
    "agent",
    "agents",
    "ai",
    "drive",
    "glean",
    "gmail",
    "knowledge-graph",
    "langchain",
    "langgraph",
    "llamaparse",
    "notion",
    "ollama",
    "perplexity",
    "python",
    "rag",
    "slack"
  ],
  "open_source": true,
  "license": "Apache-2.0",
  "last_updated": "2025-05-28",
  "language": "TypeScript"
}