{
  "category": "experimental",
  "status": "alpha",
  "purpose": "",
  "principle": "",
  "reusability": "",
  "limitations": "",
  "demo_links": [],
  "platforms": [],
  "stack": [
    "TypeScript",
    "Python",
    "Jupyter Notebook",
    "Go",
    "Rust",
    "HTML",
    "JavaScript",
    "MDX",
    "Kotlin",
    "Ruby",
    "C",
    "Shell",
    "Handlebars",
    "Java",
    "C#",
    "C++",
    "Julia",
    "PHP",
    "Bicep",
    "Scala",
    "Dart",
    "Svelte",
    "PowerShell",
    "GDScript",
    "Elixir",
    "Ballerina",
    "Vue",
    "SCSS",
    "Move",
    "Typst",
    "Clojure",
    "Lua",
    "YARA",
    "Fluent",
    "Zig"
  ],
  "name": "ScreenAgent",
  "slug": "niuzaisheng-screenagent",
  "description": "ScreenAgent: A Computer Control Agent Driven by Visual Language Large Model (IJCAI-24)",
  "repository": "https://github.com/niuzaisheng/ScreenAgent",
  "stars": 456,
  "originator": "niuzaisheng",
  "tags": [
    "agent",
    "ai",
    "llm",
    "vlm"
  ],
  "open_source": true,
  "license": "NOASSERTION",
  "last_updated": "2024-11-25",
  "language": "Python"
}