{
  "category": "experimental",
  "status": "alpha",
  "purpose": "",
  "principle": "",
  "reusability": "",
  "limitations": "",
  "demo_links": [],
  "platforms": [],
  "stack": [],
  "name": "n8n",
  "slug": "n8n-io-n8n",
  "description": "Fair-code workflow automation platform with native AI capabilities. Combine visual building with custom code, self-host or cloud, 400+ integrations.",
  "repository": "https://github.com/n8n-io/n8n",
  "stars": 100390,
  "originator": "n8n-io",
  "tags": [
    "ai",
    "apis",
    "automation",
    "cli",
    "data-flow",
    "development",
    "integration-framework",
    "integrations",
    "ipaas",
    "low-code",
    "low-code-platform",
    "mcp",
    "mcp-client",
    "mcp-server",
    "n8n",
    "no-code",
    "self-hosted",
    "typescript",
    "workflow",
    "workflow-automation"
  ],
  "open_source": true,
  "license": "NOASSERTION",
  "last_updated": "2025-05-28",
  "language": "TypeScript"
}