{
  "category": "experimental",
  "status": "alpha",
  "purpose": "",
  "principle": "",
  "reusability": "",
  "limitations": "",
  "demo_links": [],
  "platforms": [],
  "stack": [],
  "name": "jai-workflow",
  "slug": "czelabueno-jai-workflow",
  "description": "Build programmatically custom agentic workflows, AI Agents, RAG systems for java",
  "repository": "https://github.com/czelabueno/jai-workflow",
  "stars": 129,
  "originator": "czelabueno",
  "tags": [
    "agentic-ai",
    "agentic-workflow",
    "ai",
    "ai-agent",
    "ai-agent-framework",
    "gpt",
    "java",
    "openai",
    "orchestrator",
    "rag",
    "workflow-orchestration"
  ],
  "open_source": true,
  "license": "Apache-2.0",
  "last_updated": "2025-05-25",
  "language": "Java"
}